case_id	dataset_or_task	curated_truth_basis	curated_max_allowed_ceiling	ted_assigned_ceiling	required_missing_for_next_level	is_scored	curated_numeric_ceiling	ted_numeric_ceiling	ceiling_delta_ted_minus_curated	exact_ceiling_match	overclaim_error	underclaim_error	calibration_status
T01_synthetic_truth_events	synthetic_adversarial_benchmark	simulated ground truth includes event identity and artifact status but no wet-lab validation	Level_3_robust_event_or_adapter_validation	Level_3_robust_event_or_adapter_validation	real perturbation or functional rescue evidence	True	3.0	3.0	0.0	True	False	False	calibrated_exact
T02_gse271399_primary_case	GSE271399	block-robust T21/GATA1s erythroid event-loss family with matched-state and proxy support but no full-length GATA1 rescue	Level_3.5_mechanism_candidate	Level_3.5_mechanism_candidate	matched full-length GATA1 rescue with targeted RNA, flow and hemoglobinization recovery	True	3.5	3.5	0.0	True	False	False	calibrated_exact
T03_zscape_event_mode	GSE202639_ZSCAPE	perturbation, real time and embryo-block structure support event-mode classification but not functional rescue per perturbation	Level_3.5_mechanism_candidate	Level_3.5_mechanism_candidate	targeted functional rescue or orthogonal validation for individual perturbations	True	3.5	3.5	0.0	True	False	False	calibrated_exact
T04_gse157977_locked_adapter	GSE157977	locked in vivo Perturb-seq adapter with pre-specified families, negative controls and claim gates	Level_3_robust_event_or_adapter_validation	Level_3_robust_event_or_adapter_validation	guide-target recovery and high-resolution cell-state trajectory evidence	True	3.0	3.0	0.0	True	False	False	calibrated_exact
T05_gse123013_stress_sensitive	GSE123013	root fate-like signal attenuates after stress, housekeeping and wound residualization	Level_2.5_scaffold_or_adapter_candidate	Level_2.5_scaffold_or_adapter_candidate	stress-independent block-robust fate event or orthogonal root-hair validation	True	2.5	2.5	0.0	True	False	False	calibrated_exact
T06_gse155254_negative_control	GSE155254	not-comparable negative-control benchmark should not be promoted to a developmental mechanism	Level_1_descriptive_or_rejected	Level_1_descriptive_or_rejected	valid matched developmental perturbation design	True	1.0	1.0	0.0	True	False	False	calibrated_exact
T07_gse292039_public_gate	GSE292039	gene mapping and axis coverage passed, but public functional-style alignment gate did not pass	below_Level_4B	below_Level_4B	rescue/treatment contrast with axis reversal and negative-control margin	True	3.2	3.2	0.0	True	False	False	calibrated_exact
T08_functional_level4_positive_control	not_available_in_current_release	strict Level 4 requires matched functional rescue in the relevant primary system	Level_4_functional_validation	unscored_missing_positive_control	own matched GATA1 rescue or another pre-registered functional positive control	False	4.0			False	False	False	unscored_missing_evidence_stratum
